{"accountable_subject":"acct:github.com/raphaelperrut","binding_id":"task-0738-solo-executor","binding_version":"2.0.0","governance_mode":"SOLO_FUNCTIONAL_SEGREGATION_V1","personal_independence":"ABSENT_DECLARED","policy":{"profile_id":"dsgeorref-daa-operational","profile_version":"2.0.0"},"principal":{"issuer":"https://github.com","subject":"raphaelperrut"},"revoked_at":null,"role":"Executor","schema_version":"2.0.0","signature":{"algorithm":"Ed25519","key_id":"daa2-operational-binding-authority-2026","message_profile":"DSGEOREF-DELIVERY-APPROVAL-ROLE-BINDING-V2","value":"B7CZXQbUMR8_MI7y5Gt7SrQtEQr42zJLRGr3pBw31LafXaiJgDqfAbBpa0Bgvssh2SGKFdrOjcUT4DJgBLUCCA"},"task_envelope":{"digest_sha256":"f84908d577debb9bc3a4d014b8411d3b548648aebf97dcf63284868dba177270","task_id":"TASK-0738"},"trust_scope":"DSGEOREF-DELIVERY-APPROVAL-AUTHORITY-V1","valid_from":"2026-09-20T23:40:55Z","valid_until":"2027-09-20T23:40:55Z"}